,Job Title,Company,Date Posted,Post Link,Description
0,Python Developer,Reperio Human Capital Ltd,Updated 09/05/2022,https://www.irishjobs.ie/Jobs/Python-Developer-8783545.aspx,They are currently searching for a passionate Python Developer to help transform businesses and economies with new ideas and keeping up to date with new technology trends. * 3+ years experience in using Python in a working environment - They provide - Dublin (Hybrid) €350-€400 - 6 Month Rolling Contract - Hiring for a global information technology services organisation.
1,Python Developer,Harvey Nash,Updated 09/05/2022,https://www.irishjobs.ie/Jobs/Python-Developer-8783292.aspx,**Hybrid Working** The Company Our multinational investment banking client requires a Python Developer for a contract role. Our multinational investment banking client requires a Python Developer for a contract role. * 3+ years experience in Python or similar (e.g. C# or Java). Python Sql Server C# Developer - Our client values are to **Hybrid Working** The Company
2,Python (Rates Risk) Developer,Brightwater,Updated 08/05/2022,https://www.irishjobs.ie/Jobs/Python-Rates-Risk-Developer-8775118.aspx,"Some of the key components of the platform include: a globally distributed, object based database (developed in-house); a graph (DAG) based framework to manage object dependencies; a bi-temporal deal model for all financial instruments; a high performance computational grid and a Python based GUI framework."
3,Python Developer,Reperio Human Capital Ltd,Updated 08/05/2022,https://www.irishjobs.ie/Jobs/Python-Developer-8775302.aspx,I am on the search for a talented Python developer to join an internationally known strategy solutions company. * 3+ years working a Python Development setting Python Python Developer Software Engineer Python Programmer Django Flask - Dublin (Remote) 9 Month Rolling Contract €350-€400 Daily Rate Contract
4,Senior Python Engineer,Oomnitza,Updated 06/05/2022,https://www.irishjobs.ie/Jobs/Senior-Python-Engineer-8773381.aspx,"Team Oomnitza is looking for an experienced and driven Senior Python Engineer to work on the next generation of SaaS enterprise software. * Solid industry experience with Python (5+ years) and Python web frameworks (Pyramid, Django, etc.) * Knowledge of threading limitations of Python, and multi-process architecture Python SaaS Enterprise Software REST/SOAP API's"
5,Senior Python Developer Contract Ireland 6-18 Months,Spring,Updated 07/05/2022,https://www.irishjobs.ie/Jobs/Senior-Python-Developer-Contract-Ireland-8774647.aspx,My client a leader in their business is in urgent need of a talented and experienced Senior Python developer to join them on a contract basis. My client is looking for a talented senior Python developer to work in the Risk Technology team.
6,Python Developer,HedgeServ,Updated 05/05/2022,https://www.irishjobs.ie/Jobs/Python-Developer-8781065.aspx,The Back Office team is looking for a highly motivated back-end developer who will be focused on building and supporting AWS back-end applications written in Python. Create and maintain python back-end services with comprehensive automated tests - 1-2 years of experience programming in Python Python SQL communication skills teamwork
7,Python Software Engineer,Reperio Human Capital Ltd,Updated 06/05/2022,https://www.irishjobs.ie/Jobs/Python-Software-Engineer-8782552.aspx,I am working with an award-winning software company based in Dublin who are currently in need for an experienced full stack developer with strong Python programming skills. * Python 3+years Python Django Flask Developer Engineer Ireland - Location - Dublin/Remote in Ireland - Permanent Full-Time - Job Description
8,Senior Python Developer - Day Rate Contract,EOLAS – IT RECRUITMENT SPECIALISTS JOBS,Updated 06/05/2022,https://www.irishjobs.ie/Jobs/Senior-Python-Developer-Day-Rate-8782179.aspx,Python Developer – 6/12 month Contract My Dublin City Centre based client is looking for a Senior Python Developer on a contract basis for 6-12 Python Developer – 6/12 month Contract - My Dublin City Centre based client is looking for a Senior Python Developer on a contract basis for 6-12 months.
9,Senior Python Backend Engineer,Reperio Human Capital Ltd,Updated 06/05/2022,https://www.irishjobs.ie/Jobs/Senior-Python-Backend-Engineer-8773588.aspx,3+ years using Python in a working environment Python Python Django Python Engineer Python Developer - 12 Month Contract - Dublin (Remote) €450.00-€500.00 - My Artificial Intelligence client is looking for a talented senior backend engineer to join their global engineering team.
10,Python Developer - ML/AI field,Reperio Human Capital Ltd,Updated 06/05/2022,https://www.irishjobs.ie/Jobs/Python-Developer-ML-AI-field-8774041.aspx,Python Developers - ML/AI field Python | React | Node | AWS Location - Dublin/Remote Permanent Full-Time Job Description My client in Dublin are Python Developers - ML/AI field Python | React | Node | AWS - My client in Dublin are looking for experienced Python developers with an interest in the ML/AI field to join their growing team in Ireland.
11,Python Developer,Reperio Human Capital Ltd,Updated 05/05/2022,https://www.irishjobs.ie/Jobs/Python-Developer-8781797.aspx,A global tech company in Dublin are looking for Python Developers (mid-level and senior) to join their growing team. * 3+ years Python experience (mid-level) * 5+ years Python experience (senior) Python Django Flask Developer Ireland Backend - Location - Dublin/Ireland/Remote/Hybrid - Permanent Full-Time - Job Description
12,Backend Developer (Python),Reperio Human Capital Ltd,Updated 06/05/2022,https://www.irishjobs.ie/Jobs/Backend-Developer-Python-8782512.aspx,Backend Engineer- Python 6 Month Contract Dublin City Centre (Hybrid) Daily Rate Contract I am on the hunt for a for a knowledgeable and enthusiastic - Backend Engineer- Python I am on the hunt for a for a knowledgeable and enthusiastic Python Developer with extensive experience working in a Backend Development Team. * 5+ years using Python Software
13,Python Engineer,Stelfox,Updated 05/05/2022,https://www.irishjobs.ie/Jobs/Python-Engineer-8773046.aspx,"You can join one of their two teams, you can either work on greenfield projects in Python in the cloud or you can work on something different every week. * Good knowledge of Python * Open to strong Java or other mainstream programming languages developers with a strong desire to work in Python. Our client provides information"
14,Python Developer,Berkley Recruitment Group,Updated 04/05/2022,https://www.irishjobs.ie/Jobs/Python-Developer-8780795.aspx,"My client, a cutting-edge software company based in Cork are looking to hire a Python Developer on a permanent basis. * Strong proficiency and at least 5 years experience in software development ideally developing SaaS solutions in Python or Java. Python Django Flask - Cork/Remote"
15,Senior Python Developer,EOLAS – IT RECRUITMENT SPECIALISTS JOBS,Updated 04/05/2022,https://www.irishjobs.ie/Jobs/Senior-Python-Developer-8780572.aspx,"Our Dublin based Financial Services client is looking for an experienced, highly motivated Senior Python Developer to join their team. * Strong hands-on experience in Python programming Python Django Flask Python Development Backend Development Cloud SDLC - This role is to"
16,Mid/Senior Python Developer,Reperio Human Capital Ltd,Updated 04/05/2022,https://www.irishjobs.ie/Jobs/Mid-Senior-Python-Developer-8780339.aspx,Using extensive knowledge of Python you will be expected to be a vital contributor to improving their AI data solutions platform and backend development. Our client is looking for an individual who gets a thrill from problem solving and apply their experience and knowledge of Python in their day to day role. * Senior Level Python Experience
17,Senior Python Developer,FRS Recruitment,Updated 02/05/2022,https://www.irishjobs.ie/Jobs/Senior-Python-Developer-8779477.aspx,"I am recruiting for a very experienced, highly motivated Senior Python Developer to work for my client, they are a global innovator at the forefront of it's industry. * Minimum 5 years+ Python coding experience Python Node.JS JavaScript"
18,Senior Python Developer,Harvey Nash,Updated 30/04/2022,https://www.irishjobs.ie/Jobs/Senior-Python-Developer-8771868.aspx,Harvey Nash are looking for a highly skilled Senior Python developer's to join an exciting global financial giant to work on a highly interesting project in market risk. * Python Python Django Flask - The position itself will be a fast paced development role and our client is looking for an experienced developer who can hit the ground running. * Django/flask
19,Python Developer,Computer Futures,Updated 30/04/2022,https://www.irishjobs.ie/Jobs/Python-Developer-8771393.aspx,"My client is looking for a Python developer to join this very exciting startup. They have an immediate need to recruit a Python Developer to work alongside their Solution Architect and Product Development Team. - Very competent with Python, both with and without the use of frameworks such as Django and Flask - Excellent working knowledge of Python"
20,Python Engineer,Reperio Human Capital Ltd,Updated 29/04/2022,https://www.irishjobs.ie/Jobs/Python-Engineer-8778808.aspx,5+ years experience with open source languages such as Python/Spark/Scala - Cork (Remote) Daily Rate: €400-€450 - 12 month rolling contract - I am currently working with a global innovative technology company with offices in the south of Ireland. They would like an intelligent engineer to join analytics engineers on the building new data pipelines.
21,Python Developers,Reperio Human Capital Ltd,Updated 29/04/2022,https://www.irishjobs.ie/Jobs/Python-Developers-8778704.aspx,"Python | Django | PostfreSQL | Dublin | Ireland - My client in Dublin are looking for experienced backend Python developers (mid-level to senior) to join their team on a permanent, full-time basis. The ideal candidate will have strong python programming skills and will ideally have experience with Django and PostgreSQL (if your eager to learn this also helps!)."
22,Senior Python and AWS Developer - Remote anywhere in the EU,Reperio Human Capital Ltd,Updated 29/04/2022,https://www.irishjobs.ie/Jobs/Senior-Python-and-AWS-Developer-8771238.aspx,I am working with a cyber security company based in Ireland who are urgently looking for a Senior Python and AWS developer to join their team. * Strong Python development experience (3-5 years) AWS Python Remote EU Cybersecurity Ireland - Location - Ireland/EU/Remote - Permanent Full-Time - Job Description
23,Application Developer (SQL & Python),IT Alliance Group,Updated 29/04/2022,https://www.irishjobs.ie/Jobs/Application-Developer-SQL-Python-8778984.aspx,Applications Developer (SQL & Python) Leading fund management company with significant operations in 30+ countries including has an urgent - Applications Developer (SQL & Python)
24,Software Engineer  ( Python),Astreya,Updated 06/05/2022,https://www.irishjobs.ie/Jobs/Software-Engineer-Python-8771027.aspx,"Knowledge of Python/ Bash is required. Customize software for Python-based legacy systems in the network to improve system performance. Development background and experience with Python. We are looking for an experienced Software Engineer to join our Team. In this role, you will be able to design and test software that automates"
25,Python Engineer  - Contract Positions,Stelfox,Updated 27/04/2022,https://www.irishjobs.ie/Jobs/Python-Engineer-Contract-Positions-8777573.aspx,"Python Engineer - Daily Rates - Rolling Long-Term Contracts Exciting opportunities working on a global enterprise project solving complex business Python Engineer - Daily Rates - Rolling Long-Term Contracts - Comprehensive knowledge of Python Strong Linux/UNIX experience Experience building RESTful web APIs using Python frameworks such as Flask, Django"
26,Senior Python Developer - Hybrid,Solas IT  Recruitment,Updated 27/04/2022,https://www.irishjobs.ie/Jobs/Senior-Python-Developer-Hybrid-8769519.aspx,"5+ years Python development experience using web frameworks (Pyramid, Django, etc.) * Knowledge of threading limitations of Python, and multi-process architecture 'Python' 'Django 'OO Design' 'SOAP APIs' 'MySQL' 'RDS' Apply today - My client is an exciting, high-performing start-up who are changing the IT Asset Management industry. Apply today for more information."
27,Junior Python Developer,Reperio Human Capital Ltd,Updated 27/04/2022,https://www.irishjobs.ie/Jobs/Junior-Python-Developer-8777741.aspx,"I am working with a modern tech company in Dublin who are looking for a Junior (1-2 years) Python developer to join their team on a permanent, full-time basis. * 1-2years coding - Python, HTML Python Junior HTML Developer Engineer Dublin Ireland - Location - Dublin/Ireland - Permanent Full-Time - Job Description"
28,URGENT! Python Developer: Remote in Ireland,FRS Recruitment,Updated 26/04/2022,https://www.irishjobs.ie/Jobs/URGENT-Python-Developer-Remote-in-8776511.aspx,"Python Developer: Remote in Ireland My client, a leading Multinational, requires a talented Java Developer to join their Data Analytics team. Python Developer: Remote in Ireland * Proven track record in Python/Django Development python django linux oracle - My client, a leading Multinational, requires a talented Java Developer to join their Data Analytics team."
29,Python Engineer,Stelfox,Updated 26/04/2022,https://www.irishjobs.ie/Jobs/Python-Engineer-8776424.aspx,"Our client, a boutique fintech company that provides information on the financial health of public and private companies around the world, is looking to hire a Python engineer to join one of their two teams. * Good knowledge of Python"
30,Python/C++ Developer,Reperio Human Capital Ltd,Updated 25/04/2022,https://www.irishjobs.ie/Jobs/Python-C-Developer-8776293.aspx,I am working with a well established company in the fintech sector who are looking for mid and senior level Python developers who have had recent exposure to C++ to join their growing team in Dublin. * Python 4+years - Location - Dublin/Hybrid/Ireland - Permanent Full-Time - Job Description
31,"Full Stack Developer - Django, Python, PostgreSQL, AWS and Docker",REALTIME recruitment,Updated 27/04/2022,https://www.irishjobs.ie/Jobs/Full-Stack-Developer-Django-Python-8777211.aspx,Experience developing with Python. Django Python AWS Docker PostgreSQL JavaScript - Full-Stack Developer One of the most innovative companies in software solutions is looking to hire a Full Stack Developer! If you are looking to - Full-Stack Developer - One of the most innovative companies in software solutions is looking to hire a Full Stack Developer!
32,Python Developer,Brightwater,Updated 25/04/2022,https://www.irishjobs.ie/Jobs/Python-Developer-8775912.aspx,"They have an immediate requirement for a Python Developer to join their team. The client is looking for a Python Developer to work in the Finance Technology team. This position is for an experienced Python Developer with a strong ability to design & build business-critical systems, with emphasis on stability and performance."
33,Python QA Automation Engineer,EOLAS – IT RECRUITMENT SPECIALISTS JOBS,Updated 06/05/2022,https://www.irishjobs.ie/Jobs/Python-QA-Automation-Engineer-8773370.aspx,ideally the person will have good exposure to Python but they will also look at Java Automation Engineers who wish to work in a Python Test Automation environment. * ideally someone with solid programming skills in either Python or C++ Languages - QA Automation QA Automation Engineer Test Automation Engineer Python test engineer Software Developer in test
34,Backend Engineer (Python),Reperio Human Capital Ltd,Updated 26/04/2022,https://www.irishjobs.ie/Jobs/Backend-Engineer-Python-8776473.aspx,5+ years experience in backend development using Python Python Backend Developer Engineer Django Flask Go - Dublin €350-€400 Daily Rate - 6 Months Rolling Contract - I have a fantastic research and discovery client who is looking to build their backend development team.
35,Full Stack Software Engineers (Python/ UI),Stelfox,Updated 27/04/2022,https://www.irishjobs.ie/Jobs/Full-Stack-Software-Engineers-Python-8777373.aspx,"Expertise in Python programming - Full Stack Software Engineer Python Stelfox has exclusively partnered with a leading SaaS-based ITAM solutions provider delivering global IT Asset Management services to enterprise-level, SME, and pre-IPO customers."
36,"Data Scientist with Python, SQL",REALTIME recruitment,Updated 29/04/2022,https://www.irishjobs.ie/Jobs/Data-Scientist-with-Python-SQL-8771135.aspx,"Proficiency in Python, R or SAS Python R SQL - Want to work for one of the best workplaces in Ireland?? Industry giant looking for a Data Scientist to join their Irish operation. Apply - Apply sophisticated predictive modelling analysis that will result in the Organisation reach its growth target. This role is fully remote, permanent position."
37,Principal Engineer - Python + Scala + Spark + AWS + Java + Google Cloud,REALTIME recruitment,Updated 27/04/2022,https://www.irishjobs.ie/Jobs/Principal-Engineer-Python-Scala-Spark-8777210.aspx,Expertise in Python and Scala (Java desirable). Java Scala Spark Python AWS Google Cloud - Principal Engineer Are you looking to make an immediate impact at a company that welcomes diverse and bold thinking? We are looking for someone with - Principal Engineer - Are you looking to make an immediate impact at a company that welcomes diverse and bold thinking?
38,Software Engineers - Python – All Levels,Brightwater,Updated 27/04/2022,https://www.irishjobs.ie/Jobs/Software-Engineers-Python-All-Levels-8777171.aspx,They and have an immediate requirement for Software Engineers specialising in Python to join on a contract basis and to work on very interesting technical projects. My client is building a team to work on an all-new project and they have immediate opportunities for a talented Software Engineers with a focus on Python to join their team. * Python 3.x
39,Software Engineer- Python,Brightwater,Updated 26/04/2022,https://www.irishjobs.ie/Jobs/Software-Engineer-Python-8776892.aspx,My client has an immediate requirement for a talented senior Python developer to work in the Risk & Finance Technology team. You will be responsible for designing and developing web-based Python solutions to help solve complex business problems within one of the most interesting parts of one of the world’s largest banks. Comprehensive knowledge of Python
40,Senior Big Data Engineers (Spark Hadoop),Morgan McKinley,Updated 09/05/2022,https://www.irishjobs.ie/Jobs/Senior-Big-Data-Engineers-Spark-8783618.aspx,"Strong - Spark, Python/Scala/Java, Hadoop, Cloud (AWS, Azure, GCP) Spark Hadoop Python Scala AWS Azure - Senior Big Data Engineers Perm 80-120K + benefits Contract €500 - €650.day Mostly Remote / Dublin A leading fintech company based in Dublin are - Senior Big Data Engineers - Perm 80-120K + benefits - Contract €500 - €650.day - Mostly Remote / Dublin"
41,Senior Data Engineer - Big Data!,Archer Recruitment,Updated 10/05/2022,https://www.irishjobs.ie/Jobs/Senior-Data-Engineer-Big-Data-8784101.aspx,"""Big Data"" ""Spark"" ""Scala"" ""AWS"" ""Data Engineer"" ""Data Pipeline"" ""Python"" This is an excellent opportunity for a Data Engineer to take on a startup feel with the backing of a huge, global - This is an excellent opportunity for a Data Engineer to take on a startup feel with the backing of a huge, global company."
42,Senior Software Engineer,Reperio Human Capital Ltd,Updated 09/05/2022,https://www.irishjobs.ie/Jobs/Senior-Software-Engineer-8783529.aspx,"Python | Ruby | Golang | Rust - You will ideally have experience working with one of the following OOP languages - Python, Ruby, Golang or Rust. * 4+ years working with an OOP language - Python/Ruby/Golang/Rust - Senior Developer Engineer Python Ruby Golang Ireland - Language Agnostic - Ireland - Permanent Full-Time"
43,Full Stack Software Engineer,Computer Futures,Updated 09/05/2022,https://www.irishjobs.ie/Jobs/Full-Stack-Software-Engineer-8783024.aspx,"Front end development using HTML5, CSS, JavaScript and associated frameworks (Angular, React, Backbone, Node), JSON APIs, Unix Scripting (Python, Shell). The company: My client is a leading supplier of storage array systems, providing solutions to customers who are seeking a flexible, scalable and"
44,Senior Software Developer,Azon,Updated 10/05/2022,https://www.irishjobs.ie/Jobs/Senior-Software-Developer-8784022.aspx,"At least 4-5 years programming experience with Python Python AWS MySQL Git Java - We have partnered with an international, renewables focused, energy trading and services company to recruit for a Senior Software Developer for their Dublin or Letterkenny office."
45,Senior Software Engineer,Sysnet Global Solutions,Updated 09/05/2022,https://www.irishjobs.ie/Jobs/Senior-Software-Engineer-8769771.aspx,"Python Java Python Grails django SQL - Established in 1989, Sysnet Global Solutions/ VikingCloud is a leading global provider of cyber security and compliance management solutions to large acquiring organisations and their merchants."
46,Cloud Native Senior Software Engineer,Intel,Updated 10/05/2022,https://www.irishjobs.ie/Jobs/Cloud-Native-Senior-Software-Engineer-8783817.aspx,"Preferred Qualifications:Experience in Programming with at least one of the following languages: Golang, Java , Python , C/C++ Experience building distributed applications running in Cloud or HPC with cloud orchestration related technologies eg Kubernetes Docker etcLinux development experience eg Device Drivers Kernel and ..."
47,Cloud Networking Software Engineer,Intel,Updated 10/05/2022,https://www.irishjobs.ie/Jobs/Cloud-Networking-Software-Engineer-8783824.aspx,"Proficient with various programming languages with focus on C++, Go, Python, for automation or integration with multiple APIs (REST, etc). Job Description Join Intel and build a better tomorrow. Intel is in the midst of an exciting transformation, with a vision to create and extend - Job Description - Join Intel and build a better tomorrow."
48,Software Engineer,Harvey Nash,Updated 08/05/2022,https://www.irishjobs.ie/Jobs/Software-Engineer-8774848.aspx,Experience with Python Kotlin Javascript Python Role: Mid-Level Software Engineer Location: Dublin Duration: Permanent (Full Time) java Harvey Nash are partnered with one of the largest and fastest - Role: Mid-Level Software Engineer - Location: Dublin - Duration: Permanent (Full Time) java
49,Senior Software Engineer- Machine Learning,Trust in Soda,Updated 05/05/2022,https://www.irishjobs.ie/Jobs/Senior-Software-Engineer-Machine-Learning-8781280.aspx,"My client is looking for a seasoned software engineer with a background in Java/Python/Scala that's working with Machine Learning. * Experience as a Software Developer with Java, Python or Scala - Java Python Machine Learning Data - My client is looking for a seasoned - Up to €140,000 - Are you passionate about ML/AI and cyber-security??"
50,Sr Software Development Engineer - Scalability Engineer,Workday,Updated 07/05/2022,https://www.irishjobs.ie/Jobs/Sr-Software-Development-Engineer-Scalability-8782735.aspx,"Data Science: jupyter notebooks, python, pandas - Do what you love. Love what you do. At Workday, we help the world's largest organizations adapt to what's next by bringing finance, HR, and planning - At Workday, we help the world's largest organizations adapt to what's next by bringing finance, HR, and planning into a single enterprise cloud."
51,Software Development Engineer,Workday,Updated 09/05/2022,https://www.irishjobs.ie/Jobs/Software-Development-Engineer-8783596.aspx,"5+ years experience developing in a modern programming language (Golang, Ruby, Python, Java 8+, or Scala) * 3+ years experience developing in a modern programming language (Golang, Ruby, Python, Java 8+, or Scala) Do what you love. Love what you do. At Workday, we help the world's largest organizations adapt to what's next by bringing finance, HR, and planning"
52,Sr. Software Development Engineer,Xilinx part of AMD,Updated 10/05/2022,https://www.irishjobs.ie/Jobs/Sr-Software-Development-Engineer-8776252.aspx,"Python Programming and Scripting is an advantage. What you do at AMD changes everything At AMD, we push the boundaries of what is possible. We believe in changing the world for the better by driving - What you do at AMD changes everything - At AMD, we push the boundaries of what is possible."
53,Software Development Engineer,Workday,Updated 07/05/2022,https://www.irishjobs.ie/Jobs/Software-Development-Engineer-8782737.aspx,"3+ years shown ability in one of the following functional languages: Ruby, Go, or Python Do what you love. Love what you do. At Workday, we help the world's largest organizations adapt to what's next by bringing finance, HR, and planning"
54,Software Development Engineer - Deployment Tools,Workday,Updated 09/05/2022,https://www.irishjobs.ie/Jobs/Software-Development-Engineer-Deployment-Tools-8783599.aspx,"• You have 3+ years of programming experience with strong coding skills (Ruby, Python, Go). Do what you love. Love what you do. At Workday, we help the world's largest organizations adapt to what's next by bringing finance, HR, and planning"
55,Senior Data Engineer,Morgan McKinley,Updated 03/05/2022,https://www.irishjobs.ie/Jobs/Senior-Data-Engineer-8780064.aspx,"You will have a high level of expertise and experience in SQL, Python and Spark - Data Engineer Python Spark - Here we have another excellent opportunity for a - If you are looking for a fresh challenge for 2022 why not get in touch today. Here we have another excellent opportunity for a Senior Data Engineer with 8+ Years Experience"
