,Job Title,Company,Date Posted,Post Link,Description
56,Software Developer II,Overstock Ireland Ltd,Updated 10/05/2022,https://www.irishjobs.ie/Jobs/Software-Developer-II-8780809.aspx,"Ideally experience with Java but Scala/Python will also be considered - Overstock Ireland, based in Sligo, is the European software development hub for a technology driven online retailer. The Software Developer II"
57,Senior Software Engineer - Fully Remote,Archer Recruitment,Updated 05/05/2022,https://www.irishjobs.ie/Jobs/Senior-Software-Engineer-Fully-Remote-8772895.aspx,"Cloud native product Fully remote Cutting edge tech stack: Python/ Node.js, AWS and Azure This software engineering opportunity * Cutting edge tech stack: Python/ Node.js, AWS and Azure * 4 + years’ experience in Python/ Node.js Python AWS Microservices node.js * Cloud native product * Fully remote"
58,Site Reliability Engineer,Computer Futures,Updated 10/05/2022,https://www.irishjobs.ie/Jobs/Site-Reliability-Engineer-8783897.aspx,"Programming experience in Java, Python, C, C++ What's the role: Do you share our Clients passion for high availability, want to build highly scalable and available systems? As a Reliability - Do you share our Clients passion for high availability, want to build highly scalable and available systems?"
59,Golang Developer,Reperio Human Capital Ltd,Updated 08/05/2022,https://www.irishjobs.ie/Jobs/Golang-Developer-8774976.aspx,Python or Go dev experience - Golang Python Developer Engineer Ireland Remote - Location - Ireland/Europe/Remote - Permanent Full-Time - Job Description - I am working with an innovative venture-backed cyber security start-up who are looking for a Golang Developer to joint their growing team in Ireland. * Experience of APIs design and implementation
60,Cloud Infrastructure Engineer,Reperio Human Capital Ltd,Updated 09/05/2022,https://www.irishjobs.ie/Jobs/Cloud-Infrastructure-Engineer-8783539.aspx,Strong scripting in bash/python/perl - This is a chance to join a well established and secure organisation who are investing heavily in a company wide digital transformation.
61,Sr Software Development Engineer - Workday Learning,Workday,Updated 06/05/2022,https://www.irishjobs.ie/Jobs/Sr-Software-Development-Engineer-Workday-8782595.aspx,"Deep knowledge of one or more major programming languages including Java, Javascript, Kotlin, or Python Do what you love. Love what you do. At Workday, we help the world's largest organizations adapt to what's next by bringing finance, HR, and planning"
62,Senior Test Engineer - Dublin city centre,ICDS Recruitment,Updated 10/05/2022,https://www.irishjobs.ie/Jobs/Senior-Test-Engineer-Dublin-city-8784033.aspx,• Python programming - In this role you will join a fast-growing team supporting the development and test of 5G ORAN Radio Unit - In this role you will join a fast-growing team supporting the development and test of 5G ORAN Radio Unit [O-RU] products.
63,Software Developer - NodeJS,Harvey Nash,Updated 06/05/2022,https://www.irishjobs.ie/Jobs/Software-Developer-NodeJS-8782516.aspx,"Experience with backend languages such as Nodejs, C#, Scala or python. Senior Software Engineer - Backend My client is building a suite of insurance products and one of the best AI-driven recommendation systems. Software - Senior Software Engineer - Backend - My client is building a suite of insurance products and one of the best AI-driven recommendation systems."
64,Numerical Software Developer,EOLAS – IT RECRUITMENT SPECIALISTS JOBS,Updated 05/05/2022,https://www.irishjobs.ie/Jobs/Numerical-Software-Developer-8781122.aspx,They work in Python environment but they will look at candidates who have a strong C++ or Java backgrounds as long as you are happy in Python. Python Software Developer Analyst Programmer Software Engineer Numerical Developer
65,Design/Verification Engineer,Xilinx part of AMD,Updated 10/05/2022,https://www.irishjobs.ie/Jobs/Design-Verification-Engineer-8776249.aspx,"Familiarity with scripting languages: Python, Tcl, Perl - Xilinx is now part of Advanced Micro Devices (AMD). At AMD, we push the boundaries of what is possible. We believe in changing the world for the"
66,Back End Developer,Berkley Recruitment Group,Updated 04/05/2022,https://www.irishjobs.ie/Jobs/Back-End-Developer-8780801.aspx,"Experience programming in Golang (Go) or Python. Cork My client, a US based software company with a large operation here in Cork are looking to hire multiple Back End Developers to join their team. * Work closely with the team to design, code and test robust, scalable, loosely coupled components which integrate into public & private cloud infrastructures."
67,Senior AWS Platform Engineer,Morgan McKinley,Updated 01/05/2022,https://www.irishjobs.ie/Jobs/Senior-AWS-Platform-Engineer-8772378.aspx,"This is a hands-on developer role, you must be skilled in deploying and supporting your own production ready code in AWS, as well as automating the build and management of a a variety of cloud infrastructure in AWS, preferably in Python. Tech Stack: AWS, Python, Linux, Chef - AWS Platform Engineer - Contract €500-600/day - Perm €80-€100K + Benefits - 90% Remote / Dublin CC"
68,Graduate Verification Engineer,Xilinx part of AMD,Updated 10/05/2022,https://www.irishjobs.ie/Jobs/Graduate-Verification-Engineer-8776253.aspx,"Knowledge of scripting languages (Perl/Python) would be an advantage. What you do at AMD changes everything At AMD, we push the boundaries of what is possible. We believe in changing the world for the better by driving - What you do at AMD changes everything - At AMD, we push the boundaries of what is possible."
69,Platform Operations Analyst - Fully Remote,REALTIME recruitment,Updated 09/05/2022,https://www.irishjobs.ie/Jobs/Platform-Operations-Analyst-Fully-Remote-8783225.aspx,"Scripting experience such as SQL, Powershell, Bash, Python etc - Realtime have a fantastic opportunity for a Platform Operations Analyst for a globally recognised client. Our client is an award winning figure in the"
70,Senior Data Engineer - Day rate Contract,EOLAS – IT RECRUITMENT SPECIALISTS JOBS,Updated 04/05/2022,https://www.irishjobs.ie/Jobs/Senior-Data-Engineer-Day-rate-8780515.aspx,"Be familiar with the the likes of : Python, SQL, Microsoft stack (Power BI). Data Engineer - Day Rate Contract Role Our client is one of the most attractive Employers to work for in are looking for a Data Engineer to join their - Data Engineer - Day Rate Contract Role"
71,Software Engineer - Big Data DevOps,Workday,Updated 06/05/2022,https://www.irishjobs.ie/Jobs/Software-Engineer-Big-Data-DevOps-8782601.aspx,"Proficiency in programming and scripting languages such as Java, Scala, Ruby, Python or Perl - Do what you love. Love what you do. At Workday, we help the world's largest organizations adapt to what's next by bringing finance, HR, and planning"
72,XUP Engineering Intern,Xilinx part of AMD,Updated 10/05/2022,https://www.irishjobs.ie/Jobs/XUP-Engineering-Intern-8776242.aspx,"Experience with PYNQ and Python would be an advantage. What you do at AMD changes everything At AMD, we push the boundaries of what is possible. We believe in changing the world for the better by driving - What you do at AMD changes everything - At AMD, we push the boundaries of what is possible."
73,Senior/Principal Software Engineer - Distributed Systems,Workday,Updated 09/05/2022,https://www.irishjobs.ie/Jobs/Senior-Principal-Software-Engineer-Distributed-8783597.aspx,"7+ years of distributed systems engineering experience utilizing one or more of the following: Java, Scala, Python, Golang * Strong coding skills(Java/Scala/Python/Go). * 5+ years of distributed systems engineering experience utilizing one or more of the following: Java, Scala, Python, Golang - Do what you love. Love what you do."
74,Senior Cloud DevOps Engineer,PTC SSI Designated Activity Company,Updated 10/05/2022,https://www.irishjobs.ie/Jobs/Senior-Cloud-DevOps-Engineer-8780448.aspx,Coding experience using Bash/Python/Ruby - We're - Dublin - Hybrid working - It's fun to work in a company where people truly BELIEVE in what they're doing! We're committed to bringing passion and customer focus to the business. The Atlas R&D team is building the platform to support PTC’s world class SaaS Applications.
75,Graduate Verification Engineer,Xilinx part of AMD,Updated 10/05/2022,https://www.irishjobs.ie/Jobs/Graduate-Verification-Engineer-8776254.aspx,"Knowledge of scripting languages (Perl/Python) would be an advantage. What you do at AMD changes everything At AMD, we push the boundaries of what is possible. We believe in changing the world for the better by driving - What you do at AMD changes everything - At AMD, we push the boundaries of what is possible."
76,Sr. Software Development Engineer in Test (UI),Workday,Updated 05/05/2022,https://www.irishjobs.ie/Jobs/Sr-Software-Development-Engineer-in-8781873.aspx,"Experience with Python and Robot automation framework (nice to have) Do what you love. Love what you do. At Workday, we help the world's largest organizations adapt to what's next by bringing finance, HR, and planning - At Workday, we help the world's largest organizations adapt to what's next by bringing finance, HR, and planning into a single enterprise cloud."
77,Urgent! Java Backend Engineer  x 3 : Remote/Ireland,FRS Recruitment,Updated 30/04/2022,https://www.irishjobs.ie/Jobs/Urgent-Java-Backend-Engineer-x-8772137.aspx,"Develop and trouble shoot distributed applications in Java, Python and Scala * Proven track record with some of the following; Java, Python, OOAD, Linux, Docker - Java Python Scala Kafka - Urgent! Java Backend Engineer x 3 : Remote/Ireland I am partnering with this awesome SaaS company who are are the forefront of their market-space."
78,Quantitative Investment Analyst,Archer Recruitment,Updated 10/05/2022,https://www.irishjobs.ie/Jobs/Quantitative-Investment-Analyst-8784002.aspx,"Modelling experience (ideally using Python) Python Modelling Reporting - Exciting role for a Quantitative Analyst - Exciting role for a Quantitative Analyst or Data Analyst who is passionate about both quantitative modelling, and the investments domain. This is a newly created role within a team of sharp, high calibre quantitative analysts."
79,Software Developer (Node.js),EOLAS – IT RECRUITMENT SPECIALISTS JOBS,Updated 05/05/2022,https://www.irishjobs.ie/Jobs/Software-Developer-Node-js-8781711.aspx,Python. My Dublin based client is recruiting for an Software Developer to join the team on a perm basis. This role will be remote working initially with a - This role will be remote working initially with a Hybrid model after that. This role will involve both frontend using JQuery / Vue and backend with Node.js.
80,STEM Teacher Internship,Xilinx part of AMD,Updated 10/05/2022,https://www.irishjobs.ie/Jobs/STEM-Teacher-Internship-8776243.aspx,"An introduction to basic computer programming, using Python or another suitable language - What you do at AMD changes everything At AMD, we push the boundaries of what is possible. We believe in changing the world for the better by driving - What you do at AMD changes everything - At AMD, we push the boundaries of what is possible."
81,Data Analyst,Reperio Human Capital Ltd,Updated 06/05/2022,https://www.irishjobs.ie/Jobs/Data-Analyst-8782540.aspx,"Be highly proficient in SQL, R and Python as well as other data mining languages - Salary- My client, a large export business, are interested in hiring an experienced data analyst with around 3-5 years of relevant professional experience. * Be able to improve current processes * Use all available data sets in order to solve issues * Process sensitive data"
82,Senior Software Developer - Service Mesh (Venice),Workday,Updated 06/05/2022,https://www.irishjobs.ie/Jobs/Senior-Software-Developer-Service-Mesh-8782118.aspx,"Proficient in at least one of the following languages: Ruby, Go, or Python. Do what you love. Love what you do. At Workday, we help the world's largest organizations adapt to what's next by bringing finance, HR, and planning"
83,Senior Data Engineer - AWS,Archer Recruitment,Updated 03/05/2022,https://www.irishjobs.ie/Jobs/Senior-Data-Engineer-AWS-8779569.aspx,"Experience building AWS data analytic platforms, in particular strong experience in Data Warehousing based on AWS, Big Data tools such as Databricks/Spark/PySpark and programming in Python would be an advantage. * Strong Python skills - Exciting opportunity for an experienced Data Engineer to take the lead a green field Analytics and Data Science Projects."
84,Cyber Security Engineer,Reperio Human Capital Ltd,Updated 06/05/2022,https://www.irishjobs.ie/Jobs/Cyber-Security-Engineer-8782527.aspx,"Programming language favourable (Python, Java or C#) ISO27001 NIST Cyber Security Python Java - I am currently working with a client looking for a Cyber Security Engineer to implement cyber security standards in telecoms company in Ireland. The role is a 6 month contract with competitive daily rate. Skills * Knowledge of security frameworks (ISO27001, NIST or CIS)"
85,UI Web Developer,Red Chair Recruitment,Updated 10/05/2022,https://www.irishjobs.ie/Jobs/UI-Web-Developer-8779897.aspx,"These services are implemented with different technologies C ++, Python, Java, Javascript.... Our Client is a Global Technology Company with a central Dublin base The Client platform is a software platform made up of several services which - Our Client is a Global Technology Company with a central Dublin base"
86,Senior Azure Data Engineer,EOLAS – IT RECRUITMENT SPECIALISTS JOBS,Updated 03/05/2022,https://www.irishjobs.ie/Jobs/Senior-Azure-Data-Engineer-8780020.aspx,Python My Dublin-based client has a brand-new opportunity for a Senior Azure Data Engineer to join their expanding team. This is an excellent opportunity to - This is an excellent opportunity to work with the latest cloud-based technologies within a leading organisation that has an excellent reputation in the Irish market. Job Responsibilities
87,Network Automation Engineer,Hamilton Barnes,Updated 07/05/2022,https://www.irishjobs.ie/Jobs/Network-Automation-Engineer-8774285.aspx,Python and Ansible experience - The client are a global provider of payments and financial services technology solutions. Whether the customer wants to process in-house or take
88,Senior Platform Engineer – Dublin/Remote Hybrid – Software,IT Search,Updated 29/04/2022,https://www.irishjobs.ie/Jobs/Senior-Platform-Engineer-Dublin-Remote-8778554.aspx,"Cloud development, e.g. Python, Golang etc - Platform Kubernetes Terraform Scripting Python Our client is a multinational leader in Software Consultancy within the IoT and global transportation and energy sectors, providing deep technological solutions for complex industries."
89,Senior Software Engineer,Parker Stewart,Updated 05/05/2022,https://www.irishjobs.ie/Jobs/Senior-Software-Engineer-8773058.aspx,"Good experience in at least one system scripting language like Ruby, Bash/Unix shell, PowerShell, Python, Perl, Groovy or similar. Do you want to work for a company that provides an industry-leading, cloud web and mobile testing platform that enables developers to test their websites and apps on different operating systems and mobile devices?"
90,"BI Reporting Developer (SQL, Tableau, AWS)",REALTIME recruitment,Updated 29/04/2022,https://www.irishjobs.ie/Jobs/BI-Reporting-Developer-SQL-Tableau-8778886.aspx,Good command of Python “Don’t pick a job with great vacation time. Pick one that doesn’t need escaping from” BI Reporting Developer required in a fast-paced environment - Pick one that doesn’t need escaping from”
91,Infrastructure Cloud Engineer,Workday,Updated 09/05/2022,https://www.irishjobs.ie/Jobs/Infrastructure-Cloud-Engineer-8783613.aspx,"3+ years shown ability in one of the following functional languages: Ruby, Go, or Python Do what you love. Love what you do. At Workday, we help the world's largest organizations adapt to what's next by bringing finance, HR, and planning"
92,Senior Big Data Engineer,Bank of Ireland Group,Updated 09/05/2022,https://www.irishjobs.ie/Jobs/Senior-Big-Data-Engineer-8772594.aspx,"As Big Data Engineer, you'll play a senior role in developing one of the most advanced Big Data platforms in the industry (Cloudera), programming in Python and utilising a number of other tools to build data feature pipelines, including Spark, Kafka & Impala. * Experience in writing high-performance, enterprise-quality code in python/Java."
93,Full Stack Software Engineers - Remote in Ireland,Stelfox,Updated 06/05/2022,https://www.irishjobs.ie/Jobs/Full-Stack-Software-Engineers-Remote-8773556.aspx,"Here you will be working as a Full Stack Engineer mainly with Python, Django, TypeScript, Kubernetes, and a little bit of Scala. * Solid knowledge of a back-end language (e.g) Java, Python, Scala, Python, C#, Golang, C++, etc"
94,Software Engineer,PE Global,Updated 05/05/2022,https://www.irishjobs.ie/Jobs/Software-Engineer-8781416.aspx,"Experience with C, C++, Bash, Python, and Go - Linux Python C++ SATA SPI - PE Global is currently recruiting for a Software Engineer for a Fortune 500 US Technology company with a hub in Cork. This is a permanent role with - This is a permanent role with the opportunity to work fully remotely. Job Summary"
95,Senior Java Developer,Harvey Nash,Updated 07/05/2022,https://www.irishjobs.ie/Jobs/Senior-Java-Developer-8774641.aspx,Python experience an added bonus - Role: Senior Java Developer Location: Dublin Duration: Permanent (Full Time) java Harvey Nash are partnered with a leading organisation that powers - Role: Senior Java Developer - Location: Dublin - Duration: Permanent (Full Time) java
96,Senior Data Analyst,Reperio Human Capital Ltd,Updated 05/05/2022,https://www.irishjobs.ie/Jobs/Senior-Data-Analyst-8781792.aspx,"Strong background in Python Semior Data Analyst SQL Python PowerBI Tableau - Salary: 65-80,000 dependent on experience - My client, a large multinational company, are looking to recruit a senior data analyst with at least 5 years of professional experience. 1. Maintain updates between modelling team and product owners."
97,Senior Software Engineer,Harvey Nash,Updated 27/04/2022,https://www.irishjobs.ie/Jobs/Senior-Software-Engineer-8777745.aspx,"Working knowledge with some of the following is a bonus: AWS, S3, Python, Lambda development, REST APIs, Terraform **Remote Working** The Company - Our multinational financial investment client requires a Senior Software Engineer for a contract role."
98,AWS Cloud Security Architect - Contract,Stelfox,Updated 09/05/2022,https://www.irishjobs.ie/Jobs/AWS-Cloud-Security-Architect-Contract-8783258.aspx,"Strong capabilities in scripting (Python, AWS CLI, Bash) AWS Cloud Architect - Contract Role - Daily Rates - Dublin - Excellent Opportunity Job Qualifications SecOps IAM experience including management of - AWS Cloud Architect - Contract Role - Daily Rates - Dublin - Excellent Opportunity - Job Qualifications - SecOps"
99,QA Test Engineer,Reperio Human Capital Ltd,Updated 05/05/2022,https://www.irishjobs.ie/Jobs/QA-Test-Engineer-8781195.aspx,Experience in programming languages such as Python / Java / C# Quality Assurance Test Automation Selenium Cypress Java C# Python Role: QA Test Engineer Type: Contract The Company: My client are an exciting and well established company. They are committed to hiring the best - Role: QA Test Engineer - Type: Contract - My client are an exciting and well established company.
100,DevOps Engineer - Remote,FRS Recruitment,Updated 04/05/2022,https://www.irishjobs.ie/Jobs/DevOps-Engineer-Remote-8780758.aspx,Professional experience with NodeJS and/or Python Python CircleCI Bamboo Javascript NodeJS Jenkins - What YOU will be doing: Develop and Support our Machine Learning Software Infrastructure & Tools Work closely with developers to ensure the * Develop and Support our Machine Learning Software Infrastructure & Tools
101,SEO Executive,Wolfgang Digital,Updated 10/05/2022,https://www.irishjobs.ie/Jobs/SEO-Executive-8772683.aspx,Desired: Knowledge of HTML/CSS/Python/JavaScript and website administration - The SEO Executive is responsible for implementing effective SEO strategies for a broad range of clients in different competitive industries. The ideal
102,Senior Cloud Engineer - Devops,Harvey Nash,Updated 27/04/2022,https://www.irishjobs.ie/Jobs/Senior-Cloud-Engineer-Devops-8777723.aspx,"Hands-on experience with two or more scripting languages – Python, Bash etc. Cloud Devops Linux Python Kubernetes **Remote Working** The Company - Our multinational financial investment client requires a Senior Cloud Engineer for a contract role."
103,Application Security Engineer,Workday,Updated 10/05/2022,https://www.irishjobs.ie/Jobs/Application-Security-Engineer-8784075.aspx,"Practical knowledge of enterprise software development with skills in at least one modern application or system programming language e.g., Java, Scala, Kotlin, Golang, Rust, python. * Experience in scripting languages (Bash, Python, Ruby etc.) Do what you love. Love what you do."
104,Software Engineer - Analytics,Genesys,Updated 09/05/2022,https://www.irishjobs.ie/Jobs/Software-Engineer-Analytics-8783384.aspx,You are an experienced Java developer and maybe you've used Python or similar languages as well but Java is our primary code base. The Genesys Cloud Analytics platform is the foundation on which decisions are made that directly impact our customer's experience as well as their customers' experiences.
105,Data Analytics Manager,Reperio Human Capital Ltd,Updated 06/05/2022,https://www.irishjobs.ie/Jobs/Data-Analytics-Manager-8774247.aspx,"Advanced knowledge of Python Initial 12 month rolling contract - Location: Dublin, Ireland - Rate: Highly Competitive - An urgent and exciting new opportunity has opened up for a Data Manager to join my client, based in Ireland. This is an initial 12 month rolling contract with high possibility to roll over."
106,Blockchain Developers,Brightwater,Updated 03/05/2022,https://www.irishjobs.ie/Jobs/Blockchain-Developers-8780008.aspx,"Good knowledge of at least 2 more programming languages, preferably Java, Node, Python blockchain Software Development crypto Java Python About the Company - My client is a global leading enterprise-friendly blockchain company which aims to connect blockchain to real-world business. About the Position"
107,Microsoft Power Platform Product Lead,The Panel,Updated 06/05/2022,https://www.irishjobs.ie/Jobs/Microsoft-Power-Platform-Product-Lead-8781940.aspx,"Good to have experience in one or more VB, Python or Java. Overview: Our client in Management Services in Dublin delivers services to a group of companies. Their Dublin-based global services operation is to - Our client in Management Services in Dublin delivers services to a group of companies."
108,Software Development Engineer - DevOps in Cloud Orchestration,Workday,Updated 09/05/2022,https://www.irishjobs.ie/Jobs/Software-Development-Engineer-DevOps-in-8783598.aspx,"3+ years experience developing in a modern programming language (Golang, Ruby, Python, Java 8+, or Scala) * 2+ years experience developing in a modern programming language (Golang, Ruby, Python, Java 8+, or Scala) Do what you love. Love what you do. At Workday, we help the world's largest organizations adapt to what's next by bringing finance, HR, and planning"
109,Backend Engineer,Workday,Updated 06/05/2022,https://www.irishjobs.ie/Jobs/Backend-Engineer-8778452.aspx,"Some tasks are better solved with different tools, and thus we use Python for the data science parts of the system. Do what you love. Love what you do. At Workday, we help the world's largest organizations adapt to what's next by bringing finance, HR, and planning"
110,Systems Analyst,Magellan Group,Updated 10/05/2022,https://www.irishjobs.ie/Jobs/Systems-Analyst-8775783.aspx,"Proficiency in one or more general purpose programming languages & frameworks: SQL, Core Java , Python, Scripting (Unix, Javascript). * Experience with object-oriented/object function scripting languages: Python, Java, C++ etc - Magellan is looking to hire a systems analyst to play a critical role in developing new data pipelines and reporting infrastructure."
111,Data Analyst,Reperio Human Capital Ltd,Updated 03/05/2022,https://www.irishjobs.ie/Jobs/Data-Analyst-8780097.aspx,"Python Coming in as a data analyst you will be liaising with - A fantastic opportunity has arisen to join a large energy company based in Dublin. Coming in as a data analyst you will be liaising with senior figures and multiple different stakeholders, develop reports and dashboards and take part in projects with the analytics team."
112,Quantitative Investment Analyst,Brightwater,Updated 04/05/2022,https://www.irishjobs.ie/Jobs/Quantitative-Investment-Analyst-8780625.aspx,"Experience with Python, SQL or VBA - VBA Python SQL Financial Modelling - About the Company - A leading Reinsurance company Is now seeking a Quantitative Investment Analyst to join their Strategic Investments team. About the Position - The role reports directly to the Director of Investments and Quantitative Modeling."
113,Senior Cloud Platform Engineer - 6 figure package,IT Search,Updated 26/04/2022,https://www.irishjobs.ie/Jobs/Senior-Cloud-Platform-Engineer-6-8776357.aspx,"Experience with modern cloud languages (e.g. Golang, Python) Senior Cloud Platform Engineer – Dublin City Centre/Remote Top tech company offering 6 figure package and hybrid remote work to build a new SaaS - Senior Cloud Platform Engineer – Dublin City Centre/Remote - Top tech company offering 6 figure package and hybrid remote work to build a new SaaS platform."
