,Job Title,Company,Date Posted,Post Link,Description
114,System Developer & Tech Support,Excel Recruitment,Updated 04/05/2022,https://www.irishjobs.ie/Jobs/System-Developer-Tech-Support-8780372.aspx,"Experience in back-end development on Python 3/3.5+ (aiohttp). My client, based in Naas is a specialist in fleet management solutions: Vehicle Tracking, Vehicle CCTV & Tachograph Analysis."
115,Release Engineer- Improving automation and CI/CD,E-Frontiers Ltd,Updated 05/05/2022,https://www.irishjobs.ie/Jobs/Release-Engineer-Improving-automation-and-8772769.aspx,"Able to write scripts in Python, Bash or Shell - Release Engineer CI/CD Python Ansible Linux - Do you work in the software release area with a keen interest in Automation and CI/CD ? We are looking for a Release Engineer who is looking to make"
116,Investment Support Analyst – Fund Manager,Kenmar Recruitment Partners,Updated 09/05/2022,https://www.irishjobs.ie/Jobs/Investment-Support-Analyst-Fund-Manager-8783099.aspx,"Basic knowledge of Python and/or SQL Database is a plus. This is a fantastic opportunity to join a successful UCITS, fund of funds and single strategy fund management company that has been experiencing fantastic AUM growth over the last number of years. This Investment team is responsible for New Product launches, due diligence and trades."
117,Junior Data Engineer - Remote working,Archer Recruitment,Updated 03/05/2022,https://www.irishjobs.ie/Jobs/Junior-Data-Engineer-Remote-working-8779557.aspx,"The ideal individual with have strong knowledge in Python programming, AWS technologies, Spark, Kafka, Kubernetes, hive, glue etc. * Data Pipeline development/ Datawarehouse/ Data Visualization/ AWS / Python / SQL * SQL and Python"
118,Senior Infrastructure Automation Engineer,State Street,Updated 10/05/2022,https://www.irishjobs.ie/Jobs/Senior-Infrastructure-Automation-Engineer-8784074.aspx,"Develop in coding languages such as Python or/and YAML - As a Senior InfrastructureAutomation Engineer within the global Platform Engineering Team, your main responsibility will be the delivery and transformation of State Street's infrastructure towards a platform administered by codebases."
119,Infrastructure Automation Engineer,State Street,Updated 10/05/2022,https://www.irishjobs.ie/Jobs/Infrastructure-Automation-Engineer-8784072.aspx,"Develop in coding languages such as Python or/and YAML - As an Infrastructure Automation Engineer within the global Platform Engineering Team, your main responsibility will be the delivery and transformation of State Street's infrastructure towards a software designed platform, administered by codebases."
120,Principal Software Engineer,Stelfox,Updated 03/05/2022,https://www.irishjobs.ie/Jobs/Principal-Software-Engineer-8779501.aspx,8+ years of experience creating scalable object-oriented RESTful web services and applications in a modern programming language - they use Python but would consider strong engineers with other backgrounds.
121,Software Engineer - Data team,Azon,Updated 28/04/2022,https://www.irishjobs.ie/Jobs/Software-Engineer-Data-team-8777978.aspx,"They are open to candidates that come from a Java, Python, Go or Kotlin background. * Relevant work experience building applications in Java, Golang, Python, or Kotlin - Java Python go"
122,Senior and Lead Software Engineers,Webrecruit Ireland,Updated 04/05/2022,https://www.irishjobs.ie/Jobs/Senior-and-Lead-Software-Engineers-8780560.aspx,"Experience in any off C , C, JAVA, Python, R or Delphi - Dungloe, Co. Donegal - Our client is seeking Senior and Lead C# Software Engineers who want the unique opportunity to work at the cutting edge of medical device research and development. These full-time, permanent positions will be based at their site in Dungloe, Co. Donegal."
123,Junior Data Engineer,IT Search,Updated 28/04/2022,https://www.irishjobs.ie/Jobs/Junior-Data-Engineer-8770091.aspx,"Experience with open source languages such as Python/Spark/Scala/R python sql linux ETL - This role can be fulfilled remotely from anywhere in Ireland, with once a month meeting onsite in Cork. Responsibilities * Collaborating with product and analytics engineers on the build-out of new data pipelines"
124,SQL Developer Contract Dublin,Spring,Updated 05/05/2022,https://www.irishjobs.ie/Jobs/SQL-Developer-Contract-Dublin-8773290.aspx,"Powershell, Python or other (Windows and/or Unix) scripting experience. sql tsql Python My client a leading global firm is in urgent need of a talented and experienced SQL Developer to join them - My client a leading global firm is in urgent need of a talented and experienced SQL Developer to join them on a contract basis for 6-18 months."
125,Software Engineer - Infrastructure & Automation (Mid / Senior),Genesys,Updated 08/05/2022,https://www.irishjobs.ie/Jobs/Software-Engineer-Infrastructure-Automation-Mid-8782815.aspx,"You will need to have a solid understanding of Java or Python and REST API solutions and architecture. * Languages: Java, Python, Groovy * Minimum of 2+ years of Java or Python experience * Firm understanding of backend development, including Python/ Java, REST API and NoSQL solutions."
126,Senior DevOps - fully-remote in Ireland,Archer Recruitment,Updated 27/04/2022,https://www.irishjobs.ie/Jobs/Senior-DevOps-fully-remote-in-8769959.aspx,"devops automation terraform aws python scripting remote * Progress to lead * Exciting tech stack * Multi-cloud environment - An opportunity to join a global, leading AI organisation as a Senior DevOps Engineer. You’ll join a relatively new team in a crucial role for the team."
127,AI Algorithms Engineer,Intel,Updated 09/05/2022,https://www.irishjobs.ie/Jobs/AI-Algorithms-Engineer-8775576.aspx,"Minimal Qualifications- BS/MS in Computer Science or a similar field- At least 3-4 years of experience in programming- Excellent C++ programming skills- Strong production software engineering background, experience with CI, code reviews, paired programming, unit and integration testing- Proven track of experience in contributing in large-scale, ..."
128,Data Engineer Manager,AON Ireland,Updated 03/05/2022,https://www.irishjobs.ie/Jobs/Data-Engineer-Manager-8772733.aspx,"Programming experience with Scala, SPARKSQL and Python. (min 3 years) Data Engineering Manager About Aon Aon plc (NYSE:AON) is a leading global professional services firm providing a broad range of risk, retirement and - Data Engineering Manager - About Aon"
129,Fullstack Software Engineer,Oomnitza,Updated 05/05/2022,https://www.irishjobs.ie/Jobs/Fullstack-Software-Engineer-8773379.aspx,"Coding ability with backend languages, particularly Python. Software Engineering Programming Javascript python Oomnitza offers enterprise IT a unique solution to manage the entirety of the digital estate. Unlike our competitors, who deliver siloed solutions,"
130,Mid-Level Test Automation,Reperio Human Capital Ltd,Updated 04/05/2022,https://www.irishjobs.ie/Jobs/Mid-Level-Test-Automation-8772705.aspx,Experience in programming languages such as Python and Java - Role: QA Test Automation Engineer Type: Contract The Company: My client are an exciting and well established company. They are committed to hiring the - Role: QA Test Automation Engineer - Type: Contract - My client are an exciting and well established company.
131,Senior Full Stack Developer - Hybrid,Solas IT  Recruitment,Updated 26/04/2022,https://www.irishjobs.ie/Jobs/Senior-Full-Stack-Developer-Hybrid-8769514.aspx,"Python experience. My client is seeking an experienced Full Stack Engineer to work on the next generation of SaaS enterprise software. You will work on Greenfield Projects. Apply today for more information - The Role * Write reusable, testable, and efficient code. * Understand requirements and stakeholder expectations * Create design docs and technical specifications"
132,STEM Teacher Internship,Xilinx part of AMD,Updated 07/05/2022,https://www.irishjobs.ie/Jobs/STEM-Teacher-Internship-8778856.aspx,"An introduction to basic computer programming, using Python or another suitable language - What you do at AMD changes everything At AMD, we push the boundaries of what is possible. We believe in changing the world for the better by driving - What you do at AMD changes everything - At AMD, we push the boundaries of what is possible."
133,Data Analyst,Bausch + Lomb Ireland,Updated 06/05/2022,https://www.irishjobs.ie/Jobs/Data-Analyst-8782529.aspx,"Ability to develop Python code to run on Raspberry Pi OS for various applications throughout the plant * NET/C#/Python proficient - Bausch + Lomb, a leading global eye health business of Bausch Health Companies Inc., is solely focused on making people see better to live better. The"
134,QA Test Automation Engineer,Reperio Human Capital Ltd,Updated 03/05/2022,https://www.irishjobs.ie/Jobs/QA-Test-Automation-Engineer-8779624.aspx,Experience in programming languages such as Python and Java - QA Automation Test Automation Selenium Cypress Python Java - Role: QA Test Automation Engineer Type: Contract The Company: My client are an exciting and well established company. They are committed to hiring the - Role: QA Test Automation Engineer - Type: Contract
135,Senior Cybersecurity Engineer - Vulnerability Management,Workday,Updated 07/05/2022,https://www.irishjobs.ie/Jobs/Senior-Cybersecurity-Engineer-Vulnerability-Management-8776776.aspx,"Experience working with Splunk and python scripting to use APIs for automation, working with automation platforms such as Jenkins. Do what you love. Love what you do. At Workday, we help the world's largest organizations adapt to what's next by bringing finance, HR, and planning"
136,Application Security Engineer - OWASP,Archer Recruitment,Updated 06/05/2022,https://www.irishjobs.ie/Jobs/Application-Security-Engineer-OWASP-8782002.aspx,OWASP security python programming cybersecurity iso27001 * Software engineer progression * Hybrid role * Global re-insurance organisation - This client is seeking an experienced software developer looking to transition into the world of Cyber Security.
137,AI Embedded SW Development Engineer,Intel,Updated 09/05/2022,https://www.irishjobs.ie/Jobs/AI-Embedded-SW-Development-Engineer-8783070.aspx,"Familiar with object oriented programming languages and concepts, ideally C/C++ and scripting languages (python, tcl) Job Description Intel VPU IP group provides state of the art hardware and software technology enabling intelligent cameras, edge servers, personal - Job Description"
138,Senior Software Developer,Harvey Nash,Updated 29/04/2022,https://www.irishjobs.ie/Jobs/Senior-Software-Developer-8772062.aspx,"Experience in at least one of the following: Node.js, PHP, Java, Python, Modern Perl, etc. Senior Software Engineer My client is looking for a motivated Senior Software Engineer to join the engineering team in Ireland. The goal of the team - Senior Software Engineer"
139,Network Automation Engineer,Workday,Updated 07/05/2022,https://www.irishjobs.ie/Jobs/Network-Automation-Engineer-8782736.aspx,"Use your Python skills to solve sophisticated network problems. * Are an improving python developer and wish to level-up your skills and experience through code-review and mentoring. Do what you love. Love what you do. At Workday, we help the world's largest organizations adapt to what's next by bringing finance, HR, and planning"
140,Senior Back-End Engineers - Hybrid working,Stelfox,Updated 05/05/2022,https://www.irishjobs.ie/Jobs/Senior-Back-End-Engineers-Hybrid-8781072.aspx,"Expert knowledge of Python or Java programming, Frameworks, RESTful web services, Distributed Architecture/ Systems, Test Driven Development and Agile methodologies - Also open to Java Developers interested in working with Python"
141,Software Engineer,Recruiters – Looking For You,Updated 28/04/2022,https://www.irishjobs.ie/Jobs/Software-Engineer-8770284.aspx,"The ideal candidate should have the ability and experience working on Python-based web crawling systems, be comfortable communicating with our internal stakeholders to solve customer issues. * Implement features and support Job Ingestion (Python, Scrapy, Xpaths). * 1+ years of professional experience with the Python, Java programming language."
142,Senior Site Reliability Engineer - Service Engineering,Workday,Updated 09/05/2022,https://www.irishjobs.ie/Jobs/Senior-Site-Reliability-Engineer-Service-8783601.aspx,"This role requires a good understanding of Linux systems in a Production Environment as you will be part of a team that writes and maintains scripts (bash, ruby, python) that support public and private cloud environments. Do what you love. Love what you do."
143,DevOps (CI/CD) Engineer,Intel,Updated 10/05/2022,https://www.irishjobs.ie/Jobs/DevOps-CI-CD-Engineer-8779369.aspx,"Experience with one or more scripting languages, Python preferred - Job Description We are seeking a motivated and experienced DevOps Engineer. The successful candidate will work within a global IP DevOps team develop - Job Description - We are seeking a motivated and experienced DevOps Engineer."
144,Data Engineer - Contract,REALTIME recruitment,Updated 05/05/2022,https://www.irishjobs.ie/Jobs/Data-Engineer-Contract-8781348.aspx,"Strong experience with SQL & Python A leading Financial Services company in Ireland is on the lookout for an experienced Data Engineer with strong Oracle Database knowledge. In this - In this role, you will assist the Data Engineering team on their migration from legacy systems to the MS Azure cloud."
145,Associate Software Engineer,Genesys,Updated 06/05/2022,https://www.irishjobs.ie/Jobs/Associate-Software-Engineer-8782387.aspx,"You will have experience working with technologies like Java, Python and Amazon Web Services. * You are an eager programmer and know how to write quality code in Java and/or Python or Scala. * Programming skills in Java and/or Python/Scala."
146,Risk Analyst,Interactive Brokers Ireland Limited,Updated 05/05/2022,https://www.irishjobs.ie/Jobs/Risk-Analyst-8781729.aspx,Knowledge of Python/R is a plus - financial risk Python credit risk liquidity market risk capital risk risk consulting - Financial Risk Analyst The Financial Risk Analyst will be responsible for assisting in building out the Global Enterprise Risk Function and oversight - Financial Risk Analyst
147,Senior Software Engineer,Solas IT  Recruitment,Updated 28/04/2022,https://www.irishjobs.ie/Jobs/Senior-Software-Engineer-8778361.aspx,"5+ years’ Python Development experience in a senior software development role. ""Python"" ""AWS"" ""KPIs"" Due to my client’s huge success, they are continuing expansion, they are now recruiting for a talented Senior Software Engineer. You will be reporting to the VP of Engineering."
148,Technical Support Engineer,Morgan McKinley,Updated 10/05/2022,https://www.irishjobs.ie/Jobs/Technical-Support-Engineer-8783729.aspx,"Working knowledge of java, python, SQL (Postgres), MongoDB desirable but not essential. The purpose of these roles is to - We are currently seeking x2 full-time Technical Support Engineers based out of Cork."
149,Software Development & Applications Support,Kenny Whelan,Updated 08/05/2022,https://www.irishjobs.ie/Jobs/Software-Development-Applications-Support-8777384.aspx,"Understanding of C#, Python, PHP would be beneficial. Software Support .Net Programming Python C# Software Development & IT Support Engineer (Full-Time position with a hybrid working model) The successful candidate will join the Engineering - Software Development & IT Support Engineer (Full-Time position with a hybrid working model)"
150,Data Analyst - 12 month Contract,Morgan McKinley,Updated 03/05/2022,https://www.irishjobs.ie/Jobs/Data-Analyst-12-month-Contract-8780055.aspx,Experience with R / Python would be an advantage. Data Analytics (Contract) Great opportunity for an experienced Data Analyst to join a global organisation based in Cork. This is a remote opportunity - Data Analytics (Contract) Great opportunity for an experienced Data Analyst to join a global organisation based in Cork.
151,QA Test Engineer,Stelfox,Updated 06/05/2022,https://www.irishjobs.ie/Jobs/QA-Test-Engineer-8782295.aspx,"Experience with a software programming language, Python would be a distinct advantage - QA Engineer My client is looking for a Quality Control Engineer with experience in ensuring quality throughout the software development lifecycle to - QA Engineer"
152,Data Scientist,LeasePlan Insurance,Updated 08/05/2022,https://www.irishjobs.ie/Jobs/Data-Scientist-8777712.aspx,"Experience working with AWS, SQL, R and Python is highly desirable. Analytics and Business Change Department - Location: Leopardstown, Dublin 18 - The Company - Euro Insurances DAC trading as LeasePlan Insurance is a wholly owned subsidiary of LeasePlan Corporation N.V., a fleet management company that manages 1.9 million vehicles in 32 countries."
153,Data Scientist (Deep Learning),IT Search,Updated 04/05/2022,https://www.irishjobs.ie/Jobs/Data-Scientist-Deep-Learning-8780526.aspx,Experience using Python and Deep Learning - Data Scientist ML Python Opportunity for Data Scientist (Deep Learning) to join expanding Data Analytics team for a well-known multinational. The office is Dublin city centre
154,RPA Developer,Glanbia,Updated 02/05/2022,https://www.irishjobs.ie/Jobs/RPA-Developer-8779484.aspx,"• Scripting knowledge or experience (VB, Python, PowerShell etc). Company description: Glanbia is a global nutrition company, grounded in science and nature and dedicated to providing better nutrition for every step - Glanbia is a global nutrition company, grounded in science and nature and dedicated to providing better nutrition for every step of life’s journey."
155,Electronic Engineers & Electronic Technicians,Western Automation,Updated 03/05/2022,https://www.irishjobs.ie/Jobs/Electronic-Engineers-Electronic-Technicians-8779751.aspx,"Knowledge of C, C++, Python or similar Programming Language - About Western Automation : Western Automation Research & Development Limited (WA) based in Ballinasloe, Co. Galway, is acknowledged as a world"
156,Lead BI Developer (Tableau),Archer Recruitment,Updated 28/04/2022,https://www.irishjobs.ie/Jobs/Lead-BI-Developer-Tableau-8777936.aspx,"You will also have the opportunity to learn new technologies, broadening your technical skill set (for example with Python, PowerBI, data analytics). Lead Business Intelligence Developer (Lead BI Developer) role within a dedicated BI & Data Analytics function in a high growth technology product company in Dublin."
157,Senior Staff Systems Engineer,Reperio Human Capital Ltd,Updated 06/05/2022,https://www.irishjobs.ie/Jobs/Senior-Staff-Systems-Engineer-8782555.aspx,"You'll also need to be someone with rock solid scripting skills in Python or Ruby. In an ideal world, you'll also be a strong python developer, but if you work in Linux engineering and would have excellent scripting skills then we'd still want to hear from you. * Excellent scripting skills in Python or Ruby - Linux Python DevOps"
158,Senior Software Engineer (Java/Spring),Recruiters – Looking For You,Updated 25/04/2022,https://www.irishjobs.ie/Jobs/Senior-Software-Engineer-Java-Spring-8775845.aspx,"Languages: Groovy, Kotlin, Clojure, Javascript, Swift/Objective-C, Python Want to work for a Global Technology US Multinational with EMEA HQ in Dublin, in this role you will be working alongside talented product managers, software engineers, UX designers and our site reliability engineering team in a highly AGILE Environment."
159,DevOps Engineer,Recruiters – Looking For You,Updated 07/05/2022,https://www.irishjobs.ie/Jobs/DevOps-Engineer-8774503.aspx,"Python AWS Jenkins Terraform - How would you like to work with a company that makes the internet a safer and fairer place to be? This sophisticated cybersecurity company is looking - This sophisticated cybersecurity company is looking for a DevOps Engineer to join their robust team who are specializing in cloud, IoT, and driven network detection."
160,Senior Data Engineer,Reperio Human Capital Ltd,Updated 25/04/2022,https://www.irishjobs.ie/Jobs/Senior-Data-Engineer-8776305.aspx,"Programming experience in Python and/or Java - This We're working exclusively with a global multimedia company who have ambitious plans to expand their IT presence in Ireland. This company is a leading provider of cutting-edge solutions, services and content and they are the current trend setters within their industry"
161,Technical Solutions Engineer,Red Chair Recruitment,Updated 10/05/2022,https://www.irishjobs.ie/Jobs/Technical-Solutions-Engineer-8779900.aspx,"Knowledge and practice of Unix/SQL/Scripting (Python, Bash) Problem-solving, Java, C++, Unix/SQL/Scripting (Python, Bash), Performance Analysis, R&D - Java C++ Performance Analysis R&D Scripting Python Candidates will have between 2 and 4 years within a technical role that might include a mix of software development, testing, design, support, etc."
162,IT Information Security Analyst - Associate,UPMC Ireland,Updated 09/05/2022,https://www.irishjobs.ie/Jobs/IT-Information-Security-Analyst-Associate-8783185.aspx,"Ability to automate and script tasks (e.g. Python, PowerShell, BASH). UPMC Do you want to change the face of healthcare? UPMC’s Global Technology Operations Centre (GTOC) is enabling the next generation of healthcare - Do you want to change the face of healthcare?"
163,Senior Software Engineers - New Digital Healthcare Solutions,Stelfox,Updated 28/04/2022,https://www.irishjobs.ie/Jobs/Senior-Software-Engineers-New-Digital-8770655.aspx,"Nodejs/Java/Python engineers with API Management and/or API Gateway experience - Apigee, Kong, OpenAPI or others * Strong Java coding experience as primarily language (Java8/11/13) with an additional language as added bonus such as Nodejs, Python, Javascript."
164,Full Stack Engineer,Stelfox,Updated 27/04/2022,https://www.irishjobs.ie/Jobs/Full-Stack-Engineer-8777156.aspx,"More specifically you will work with the team that is responsible for building integrations between our client and their partner video conferencing apps, content platforms and productivity apps using Python (Django) and Typescript in React."
165,Software Engineer - Integrations (Remote),Stelfox,Updated 03/05/2022,https://www.irishjobs.ie/Jobs/Software-Engineer-Integrations-Remote-8779685.aspx,"1-3 years of Python knowledge & experience. * Firm understanding of backend development, including Python, Jinja 2 template language, Stelfox has exclusively partnered with a leading SaaS-based ITAM solutions provider delivering global IT Asset Management services to enterprise-level, SME, and pre-IPO customers."
166,Senior Software Engineer - Backend,WP Engine Ireland Limited,Updated 05/05/2022,https://www.irishjobs.ie/Jobs/Senior-Software-Engineer-Backend-8773899.aspx,"Proficient programming in Go, Python, PHP, and/or Ruby - It's fun to work in a company where people truly BELIEVE in what they're doing! We're committed to bringing passion and customer focus to the - We're committed to bringing passion and customer focus to the business. We are on a mission to help our customers win online."
167,Head of Engineering- Fully Remote,Trust in Soda,Updated 05/05/2022,https://www.irishjobs.ie/Jobs/Head-of-Engineering-Fully-Remote-8781259.aspx,Tech Skills are predominantly Python/React focused but you don't necessarily need this experience. Head of Engineering Saas Company Fully remote One of Ireland Fastest Growing Saas based companies is expanding and requires an experienced Head of - Head of Engineering - Saas Company - Fully remote
168,DMO Product Development Engineer,Intel,Updated 06/05/2022,https://www.irishjobs.ie/Jobs/DMO-Product-Development-Engineer-8782106.aspx,"Although not essential, an understanding of Circuit Test/Design, Semiconductor Device physics, Data Analytics, Scripting (Python, SQL, Perl and C, C#) would be very beneficial - Job Description Our Purpose: To bring smart, connected devices to every person on earth We lead the semiconductor industry by creating innovative - Job Description"
169,QA SDET,Reperio Human Capital Ltd,Updated 02/05/2022,https://www.irishjobs.ie/Jobs/QA-SDET-8772543.aspx,QA SDET - 12 Month Contract I have an exciting opportunity for two SDET's to join a new client of mine. My client are based in Dublin and will offer
170,Medical Device Software and Firmware Engineer,BD Medical,Updated 04/05/2022,https://www.irishjobs.ie/Jobs/Medical-Device-Software-and-Firmware-8772700.aspx,"Application Development: C++, C# or Python in an embedded environment - o GUI Development: C++, Python, OpenGL, DirectX - Job Description Summary Job Description Medical Device Software Engineer Intro Are you ready to make a difference in this world? Join Becton Dickinson - Job Description Summary - Job Description - Medical Device Software Engineer - Intro"
171,DevOps (CI/CD) Engineer,Intel,Updated 07/05/2022,https://www.irishjobs.ie/Jobs/DevOps-CI-CD-Engineer-8782678.aspx,"Experience with one or more scripting languages, Python preferred - Job Description You will be part of a global working environment with colleagues located around the globe. Joining us means joining a dynamic team at - Job Description - You will be part of a global working environment with colleagues located around the globe."
172,Medical Device Software and Firmware Engineer,BD Medical,Updated 04/05/2022,https://www.irishjobs.ie/Jobs/Medical-Device-Software-and-Firmware-8772700.aspx,"Application Development: C++, C# or Python in an embedded environment - o GUI Development: C++, Python, OpenGL, DirectX - Job Description Summary Job Description Medical Device Software Engineer Intro Are you ready to make a difference in this world? Join Becton Dickinson - Job Description Summary - Job Description - Medical Device Software Engineer - Intro"
